{
  "schema": "receipts.metrics/jordan-lee/2026-03",
  "version": 1,
  "rev": 1,
  "updatedAt": "2026-03-28T12:00:00.000Z",
  "items": [
    {
      "id": "ado.closed",
      "updatedAt": 1792508400000,
      "source": "ado",
      "value": 4,
      "unit": "work items",
      "detail": [
        {
          "id": "WI-1",
          "title": "Synthetic item"
        }
      ],
      "collectedAt": "2026-03-28T12:00:00.000Z"
    },
    {
      "id": "prioritizer.done",
      "updatedAt": 1792508400000,
      "source": "prioritizer",
      "value": 7,
      "unit": "tasks",
      "detail": [],
      "collectedAt": "2026-03-28T12:00:00.000Z"
    }
  ],
  "meta": {
    "updatedAt": 1792508400000,
    "personId": "jordan-lee",
    "month": "2026-03",
    "collectedAt": "2026-03-28T12:00:00.000Z"
  }
}
